{
  "schemaVersion": 1,
  "artifactId": "vcg-seated-partial-assisted-synthetic-matrix-v1",
  "evidenceClass": "camera-free-synthetic-contract-exercise",
  "evidenceDate": "2026-07-24",
  "qualification": "not-product-qualification",
  "policy": {
    "seatedGameplayMotionAuthorized": false,
    "assistedBodyMotionAuthorized": false,
    "silentLandmarkExtrapolationAuthorized": false,
    "silentScoreNormalizationAuthorized": false,
    "newBodyAlternateMappingsAuthorized": false,
    "standardControllerFallbackRetained": true,
    "reservedHomeBackPauseRemappable": false
  },
  "scenarios": [
    {
      "scenarioId": "standing-full-independent-controller",
      "posture": "standing",
      "assistance": "independent",
      "hiddenLandmarks": [],
      "controllerAvailable": true,
      "availabilityState": "full",
      "availableMotionControlCountBeforeSafetyGate": 6,
      "controls": [
        {
          "controlGroup": "menuSelect",
          "observedPath": "available",
          "safetyGate": "permitted",
          "supportLabel": "synthetic-motion-path",
          "alternateMapping": null
        },
        {
          "controlGroup": "menuBackPause",
          "observedPath": "available",
          "safetyGate": "permitted",
          "supportLabel": "synthetic-motion-path",
          "alternateMapping": null
        },
        {
          "controlGroup": "menuSwipe",
          "observedPath": "available",
          "safetyGate": "permitted",
          "supportLabel": "synthetic-motion-path",
          "alternateMapping": null
        },
        {
          "controlGroup": "gameDodge",
          "observedPath": "available",
          "safetyGate": "permitted",
          "supportLabel": "synthetic-motion-path",
          "alternateMapping": null
        },
        {
          "controlGroup": "gameDuck",
          "observedPath": "available",
          "safetyGate": "permitted",
          "supportLabel": "synthetic-motion-path",
          "alternateMapping": null
        },
        {
          "controlGroup": "gameJump",
          "observedPath": "available",
          "safetyGate": "permitted",
          "supportLabel": "synthetic-motion-path",
          "alternateMapping": null
        }
      ]
    },
    {
      "scenarioId": "seated-full-independent-controller",
      "posture": "seated",
      "assistance": "independent",
      "hiddenLandmarks": [],
      "controllerAvailable": true,
      "availabilityState": "full",
      "availableMotionControlCountBeforeSafetyGate": 6,
      "controls": [
        {
          "controlGroup": "menuSelect",
          "observedPath": "available",
          "safetyGate": "permitted",
          "supportLabel": "synthetic-motion-path",
          "alternateMapping": null
        },
        {
          "controlGroup": "menuBackPause",
          "observedPath": "available",
          "safetyGate": "permitted",
          "supportLabel": "synthetic-motion-path",
          "alternateMapping": null
        },
        {
          "controlGroup": "menuSwipe",
          "observedPath": "available",
          "safetyGate": "permitted",
          "supportLabel": "synthetic-motion-path",
          "alternateMapping": null
        },
        {
          "controlGroup": "gameDodge",
          "observedPath": "available",
          "safetyGate": "blocked-seated-gameplay-unqualified",
          "supportLabel": "controller-alternate-only",
          "alternateMapping": {
            "mappingId": "canonical-controller-v1",
            "route": "title-declared-controller-dodge",
            "authority": "existing-controller-path-only"
          }
        },
        {
          "controlGroup": "gameDuck",
          "observedPath": "available",
          "safetyGate": "blocked-seated-gameplay-unqualified",
          "supportLabel": "controller-alternate-only",
          "alternateMapping": {
            "mappingId": "canonical-controller-v1",
            "route": "title-declared-controller-duck",
            "authority": "existing-controller-path-only"
          }
        },
        {
          "controlGroup": "gameJump",
          "observedPath": "available",
          "safetyGate": "blocked-seated-gameplay-unqualified",
          "supportLabel": "controller-alternate-only",
          "alternateMapping": {
            "mappingId": "canonical-controller-v1",
            "route": "title-declared-controller-jump",
            "authority": "existing-controller-path-only"
          }
        }
      ]
    },
    {
      "scenarioId": "seated-upper-body-controller",
      "posture": "seated",
      "assistance": "independent",
      "hiddenLandmarks": [
        "left_hip",
        "right_hip",
        "left_knee",
        "right_knee",
        "left_ankle",
        "right_ankle"
      ],
      "controllerAvailable": true,
      "availabilityState": "partial",
      "availableMotionControlCountBeforeSafetyGate": 4,
      "controls": [
        {
          "controlGroup": "menuSelect",
          "observedPath": "available",
          "safetyGate": "permitted",
          "supportLabel": "synthetic-motion-path",
          "alternateMapping": null
        },
        {
          "controlGroup": "menuBackPause",
          "observedPath": "available",
          "safetyGate": "permitted",
          "supportLabel": "synthetic-motion-path",
          "alternateMapping": null
        },
        {
          "controlGroup": "menuSwipe",
          "observedPath": "available",
          "safetyGate": "permitted",
          "supportLabel": "synthetic-motion-path",
          "alternateMapping": null
        },
        {
          "controlGroup": "gameDodge",
          "observedPath": "unavailable",
          "safetyGate": "blocked-seated-gameplay-unqualified",
          "supportLabel": "controller-alternate-only",
          "alternateMapping": {
            "mappingId": "canonical-controller-v1",
            "route": "title-declared-controller-dodge",
            "authority": "existing-controller-path-only"
          }
        },
        {
          "controlGroup": "gameDuck",
          "observedPath": "available",
          "safetyGate": "blocked-seated-gameplay-unqualified",
          "supportLabel": "controller-alternate-only",
          "alternateMapping": {
            "mappingId": "canonical-controller-v1",
            "route": "title-declared-controller-duck",
            "authority": "existing-controller-path-only"
          }
        },
        {
          "controlGroup": "gameJump",
          "observedPath": "unavailable",
          "safetyGate": "blocked-seated-gameplay-unqualified",
          "supportLabel": "controller-alternate-only",
          "alternateMapping": {
            "mappingId": "canonical-controller-v1",
            "route": "title-declared-controller-jump",
            "authority": "existing-controller-path-only"
          }
        }
      ]
    },
    {
      "scenarioId": "partial-legs-missing-controller",
      "posture": "standing",
      "assistance": "independent",
      "hiddenLandmarks": [
        "left_knee",
        "right_knee",
        "left_ankle",
        "right_ankle"
      ],
      "controllerAvailable": true,
      "availabilityState": "partial",
      "availableMotionControlCountBeforeSafetyGate": 5,
      "controls": [
        {
          "controlGroup": "menuSelect",
          "observedPath": "available",
          "safetyGate": "permitted",
          "supportLabel": "synthetic-motion-path",
          "alternateMapping": null
        },
        {
          "controlGroup": "menuBackPause",
          "observedPath": "available",
          "safetyGate": "permitted",
          "supportLabel": "synthetic-motion-path",
          "alternateMapping": null
        },
        {
          "controlGroup": "menuSwipe",
          "observedPath": "available",
          "safetyGate": "permitted",
          "supportLabel": "synthetic-motion-path",
          "alternateMapping": null
        },
        {
          "controlGroup": "gameDodge",
          "observedPath": "available",
          "safetyGate": "permitted",
          "supportLabel": "synthetic-motion-path",
          "alternateMapping": null
        },
        {
          "controlGroup": "gameDuck",
          "observedPath": "available",
          "safetyGate": "permitted",
          "supportLabel": "synthetic-motion-path",
          "alternateMapping": null
        },
        {
          "controlGroup": "gameJump",
          "observedPath": "unavailable",
          "safetyGate": "permitted",
          "supportLabel": "controller-alternate-only",
          "alternateMapping": {
            "mappingId": "canonical-controller-v1",
            "route": "title-declared-controller-jump",
            "authority": "existing-controller-path-only"
          }
        }
      ]
    },
    {
      "scenarioId": "partial-left-side-no-controller",
      "posture": "standing",
      "assistance": "independent",
      "hiddenLandmarks": [
        "left_eye",
        "left_ear",
        "left_shoulder",
        "left_elbow",
        "left_wrist",
        "left_hip",
        "left_knee",
        "left_ankle"
      ],
      "controllerAvailable": false,
      "availabilityState": "unavailable",
      "availableMotionControlCountBeforeSafetyGate": 0,
      "controls": [
        {
          "controlGroup": "menuSelect",
          "observedPath": "unavailable",
          "safetyGate": "permitted",
          "supportLabel": "unsupported",
          "alternateMapping": null
        },
        {
          "controlGroup": "menuBackPause",
          "observedPath": "unavailable",
          "safetyGate": "permitted",
          "supportLabel": "unsupported",
          "alternateMapping": null
        },
        {
          "controlGroup": "menuSwipe",
          "observedPath": "unavailable",
          "safetyGate": "permitted",
          "supportLabel": "unsupported",
          "alternateMapping": null
        },
        {